<?xml version="1.0" encoding="UTF-8"?>
<factura xmlns:xsi="http://www.w3.org/2001/XMLSchema-instance"
 xsi:noNamespaceSchemaLocation="xsd_ejercicio_12.xsd" cod_fac="999">
    <datos_empresa>
        <nombre>Equipos Digitales S.L.</nombre>
        <dir>Av. Valladolid</dir>
        <cod_postal>28043</cod_postal>
        <poblacion>Madrid</poblacion>
        <provincia>Madrid</provincia>
        <cif>Q98765433</cif>
        <telefono />
    </datos_empresa>
    <datos_cliente cod_cli="879">
        <nombre>Darío Bueno Gutiérrez</nombre>
        <dir_env>Av. Oporto nº7 4ºd</dir_env>
        <cod_postal>28043</cod_postal>
        <poblacion>Madrid</poblacion>
        <provincia>Madrid</provincia>
    </datos_cliente>
    <datos_factura cod_ped="731" iva="21" forma_pago="efectivo" moneda="euro">
        <fecha>2005-12-01</fecha>
        <linea>
            <ref>MII93000F/8</ref>
            <desc>MICRO PENTIUM IV 3000MHZ FB800</desc>
            <cant>1</cant>
            <precio>230</precio>
            <subtotal>230</subtotal>
        </linea>
        <linea>
            <ref>MB8QDIP4</ref>
            <desc>PLACA BASE QDI P4</desc>
            <cant>1</cant>
            <precio>208.80</precio>
            <subtotal>208.80</subtotal>
        </linea>
        <linea>
            <ref>MEDD512M32</ref>
            <desc>DIMM DDR 512MB 3200</desc>
            <cant>2</cant>
            <precio>40</precio>
            <subtotal>80</subtotal>
        </linea>
        <linea>
            <ref>HD250GSA7</ref>
            <desc>DISCO DURO 250GB S-ATA 7200</desc>
            <cant>4</cant>
            <precio>60.10</precio>
            <subtotal>240.40</subtotal>
        </linea>
        <base>759.2</base>
        <cuota_iva>159.43</cuota_iva>
        <total>918.63</total>
    </datos_factura>
</factura>